{
  "$schema": "https://json-schema.org/draft/2020-12/schema",
  "$id": "https://fliks-app.github.io/fliks-plugin-catalog/schema/plugin.schema.v0.json",
  "title": "Fliks plugin catalog submission",
  "description": "One plugins/<id>/versions/<version>.json file. Every field is required by either the consumer's CatalogDocument parser (backend/src/modules/plugins/catalog/catalog.ts) or the install pipeline that reads a catalog version entry (backend/src/modules/plugins/plugin-install.service.ts). name/description/author/kind are plugin-level and must be identical across every version of the same id; the catalog carries one of each per plugin.",
  "type": "object",
  "additionalProperties": false,
  "if": { "properties": { "pluginApi": { "minimum": 2 }, "kind": { "const": "process" } }, "required": ["pluginApi", "kind"] },
  "then": {
    "properties": {
      "zipUrl": {
        "pattern": "^https://github\\.com/fliks-app/[^/]+/releases/download/v[^/]+/[^/]+\\.fkplugin$",
        "description": "pluginApi 2 process archives are assets of the plugin repo's v<version> release, named <id>-<version>.fkplugin (checked by validate-entry.mjs). Data plugins keep the Pages path."
      }
    }
  },
  "required": [
    "id",
    "name",
    "description",
    "author",
    "kind",
    "version",
    "pluginApi",
    "fliks",
    "zipUrl",
    "sha256"
  ],
  "properties": {
    "id": {
      "type": "string",
      "pattern": "^[a-z][a-z0-9]*(\\.[a-z0-9]+)*$",
      "description": "Reverse-DNS-style plugin id, e.g. \"fliks.download\". Required non-empty by CatalogPluginEntry.id."
    },
    "name": {
      "type": "string",
      "minLength": 1,
      "description": "Human-readable name. CatalogPluginEntry.name (any string, but the catalog gains nothing from an empty one)."
    },
    "description": {
      "type": "string",
      "minLength": 1,
      "description": "CatalogPluginEntry.description."
    },
    "author": {
      "type": "string",
      "minLength": 1,
      "description": "CatalogPluginEntry.author."
    },
    "kind": {
      "type": "string",
      "enum": [
        "data",
        "process"
      ],
      "description": "CatalogPluginEntry.kind \u2014 must match the PluginKind declared inside the signed plugin.json this version points to."
    },
    "version": {
      "type": "string",
      "pattern": "^\\d+\\.\\d+\\.\\d+(-[0-9A-Za-z-]+(\\.[0-9A-Za-z-]+)*)?(\\+[0-9A-Za-z-]+(\\.[0-9A-Za-z-]+)*)?$",
      "description": "CatalogVersionEntry.version. Required non-empty; must be valid semver."
    },
    "pluginApi": {
      "type": "integer",
      "minimum": 0,
      "description": "CatalogVersionEntry.pluginApi. Checked at catalog and install time against the versions core supports (SUPPORTED_PLUGIN_API_VERSIONS in fliks server/crates/server/src/plugins/manifest.rs, currently 2; see COMPATIBILITY.md). Not required to equal one value here \u2014 an old version entry legitimately keeps whatever pluginApi it shipped with."
    },
    "fliks": {
      "type": "string",
      "minLength": 1,
      "description": "CatalogVersionEntry.fliks \u2014 a semver range parsed with semver.validRange, and a mandatory upper bound (plan decision 16). e.g. \">=2.1.0 <3.0.0\", never \">=2.1.0\" alone."
    },
    "zipUrl": {
      "type": "string",
      "format": "uri",
      "pattern": "^https://",
      "description": "Install-pipeline field read by plugin-install.service.ts's installFromCatalog (A1: GET <zipUrl>). Not read by parseCatalogDocument itself, but required for the entry to be installable."
    },
    "sha256": {
      "type": "string",
      "pattern": "^[0-9a-f]{64}$",
      "description": "Lowercase hex sha256 of the exact .fkplugin archive bytes at zipUrl. Checked (A2) against the downloaded bytes before any archive guard runs \u2014 this is the value that makes the catalog itself part of the trust chain, not just a directory."
    },
    "logo": {
      "type": "string",
      "format": "uri",
      "pattern": "^https://",
      "description": "Display-only, read by the client's catalogue card (CatalogPlugin.logo). Absolute https URL: the card renders it before anything is installed, so a path inside the archive is unreachable."
    }
  }
}
