{
  "id": "fliks.download",
  "name": "Download",
  "description": "Indexer search, download-client management and the acquisition grab pipeline for Fliks.",
  "author": "Fliks",
  "kind": "process",
  "version": "1.0.1",
  "pluginApi": 2,
  "fliks": ">=5.0.0 <6.0.0",
  "zipUrl": "https://github.com/fliks-app/fk-plugin-download/releases/download/v1.0.1/fliks.download-1.0.1.fkplugin",
  "sha256": "0000000000000000000000000000000000000000000000000000000000000000",
  "logo": "https://fliks-app.github.io/fliks-plugin-catalog/plugins/fliks.download/logo.svg"
}
